{
  "kind": "FloatingPointScannerValidationCorpus",
  "schema_version": "1.0",
  "reviewer": "RvPort floating-point scanner maintainers",
  "review_revision": "p5.5-2026-10-12",
  "cases": [
    {
      "case_id": "long-double-abi-positive-01",
      "fixture_digest": "861103a3816113e651b6a7fcf7261eedce97f64f6eb66024f87483328c821798",
      "language_standard": "c17",
      "input_mode": "shared-bitcode",
      "source_profile": "x86_64-linux-gnu-clang21@1.0",
      "target_profile": "riscv64-linux-gnu-lp64d-clang21@1.0",
      "rule_code": "long-double-abi",
      "scope": "fixtures/long-double-abi/positive-1",
      "expected_status": "matched",
      "finding_keys": [
        "long-double-abi:positive:1"
      ],
      "diagnostic_codes": [],
      "suppression_ids": [],
      "unsupported": false,
      "lifecycle": false,
      "review_basis": "reviewed positive boundary for long-double-abi"
    },
    {
      "case_id": "long-double-abi-positive-02",
      "fixture_digest": "861103a3816113e651b6a7fcf7261eedce97f64f6eb66024f87483328c821798",
      "language_standard": "c++17",
      "input_mode": "ast-ir-evidence",
      "source_profile": "x86_64-linux-gnu-clang21@1.0",
      "target_profile": "riscv64-linux-gnu-lp64d-clang21@1.0",
      "rule_code": "long-double-abi",
      "scope": "fixtures/long-double-abi/positive-2",
      "expected_status": "matched",
      "finding_keys": [
        "long-double-abi:positive:2"
      ],
      "diagnostic_codes": [],
      "suppression_ids": [],
      "unsupported": false,
      "lifecycle": false,
      "review_basis": "reviewed positive boundary for long-double-abi"
    },
    {
      "case_id": "long-double-abi-positive-03",
      "fixture_digest": "861103a3816113e651b6a7fcf7261eedce97f64f6eb66024f87483328c821798",
      "language_standard": "c++20",
      "input_mode": "ast-only",
      "source_profile": "x86_64-linux-gnu-clang21@1.0",
      "target_profile": "riscv64-linux-gnu-lp64d-clang21@1.0",
      "rule_code": "long-double-abi",
      "scope": "fixtures/long-double-abi/positive-3",
      "expected_status": "matched",
      "finding_keys": [
        "long-double-abi:positive:3"
      ],
      "diagnostic_codes": [],
      "suppression_ids": [],
      "unsupported": false,
      "lifecycle": false,
      "review_basis": "reviewed positive boundary for long-double-abi"
    },
    {
      "case_id": "long-double-abi-positive-04",
      "fixture_digest": "861103a3816113e651b6a7fcf7261eedce97f64f6eb66024f87483328c821798",
      "language_standard": "c11",
      "input_mode": "shared-bitcode",
      "source_profile": "x86_64-linux-gnu-clang21@1.0",
      "target_profile": "riscv64-linux-gnu-lp64d-clang21@1.0",
      "rule_code": "long-double-abi",
      "scope": "fixtures/long-double-abi/positive-4",
      "expected_status": "matched",
      "finding_keys": [
        "long-double-abi:positive:4"
      ],
      "diagnostic_codes": [],
      "suppression_ids": [],
      "unsupported": false,
      "lifecycle": false,
      "review_basis": "reviewed positive boundary for long-double-abi"
    },
    {
      "case_id": "long-double-abi-positive-05",
      "fixture_digest": "861103a3816113e651b6a7fcf7261eedce97f64f6eb66024f87483328c821798",
      "language_standard": "c17",
      "input_mode": "ast-ir-evidence",
      "source_profile": "x86_64-linux-gnu-clang21@1.0",
      "target_profile": "riscv64-linux-gnu-lp64d-clang21@1.0",
      "rule_code": "long-double-abi",
      "scope": "fixtures/long-double-abi/positive-5",
      "expected_status": "matched",
      "finding_keys": [
        "long-double-abi:positive:5"
      ],
      "diagnostic_codes": [],
      "suppression_ids": [],
      "unsupported": false,
      "lifecycle": false,
      "review_basis": "reviewed positive boundary for long-double-abi"
    },
    {
      "case_id": "long-double-abi-positive-06",
      "fixture_digest": "861103a3816113e651b6a7fcf7261eedce97f64f6eb66024f87483328c821798",
      "language_standard": "c++17",
      "input_mode": "ast-only",
      "source_profile": "x86_64-linux-gnu-clang21@1.0",
      "target_profile": "riscv64-linux-gnu-lp64d-clang21@1.0",
      "rule_code": "long-double-abi",
      "scope": "fixtures/long-double-abi/positive-6",
      "expected_status": "matched",
      "finding_keys": [
        "long-double-abi:positive:6"
      ],
      "diagnostic_codes": [],
      "suppression_ids": [],
      "unsupported": false,
      "lifecycle": false,
      "review_basis": "reviewed positive boundary for long-double-abi"
    },
    {
      "case_id": "long-double-abi-negative-01",
      "fixture_digest": "861103a3816113e651b6a7fcf7261eedce97f64f6eb66024f87483328c821798",
      "language_standard": "c17",
      "input_mode": "shared-bitcode",
      "source_profile": "x86_64-linux-gnu-clang21@1.0",
      "target_profile": "riscv64-linux-gnu-lp64d-clang21@1.0",
      "rule_code": "long-double-abi",
      "scope": "fixtures/long-double-abi/negative-1",
      "expected_status": "not_matched",
      "finding_keys": [],
      "diagnostic_codes": [],
      "suppression_ids": [],
      "unsupported": false,
      "lifecycle": false,
      "review_basis": "reviewed negative boundary for long-double-abi"
    },
    {
      "case_id": "long-double-abi-negative-02",
      "fixture_digest": "861103a3816113e651b6a7fcf7261eedce97f64f6eb66024f87483328c821798",
      "language_standard": "c++17",
      "input_mode": "ast-ir-evidence",
      "source_profile": "x86_64-linux-gnu-clang21@1.0",
      "target_profile": "riscv64-linux-gnu-lp64d-clang21@1.0",
      "rule_code": "long-double-abi",
      "scope": "fixtures/long-double-abi/negative-2",
      "expected_status": "not_matched",
      "finding_keys": [],
      "diagnostic_codes": [],
      "suppression_ids": [],
      "unsupported": false,
      "lifecycle": false,
      "review_basis": "reviewed negative boundary for long-double-abi"
    },
    {
      "case_id": "long-double-abi-negative-03",
      "fixture_digest": "861103a3816113e651b6a7fcf7261eedce97f64f6eb66024f87483328c821798",
      "language_standard": "c++20",
      "input_mode": "ast-only",
      "source_profile": "x86_64-linux-gnu-clang21@1.0",
      "target_profile": "riscv64-linux-gnu-lp64d-clang21@1.0",
      "rule_code": "long-double-abi",
      "scope": "fixtures/long-double-abi/negative-3",
      "expected_status": "not_matched",
      "finding_keys": [],
      "diagnostic_codes": [],
      "suppression_ids": [],
      "unsupported": false,
      "lifecycle": false,
      "review_basis": "reviewed negative boundary for long-double-abi"
    },
    {
      "case_id": "long-double-abi-negative-04",
      "fixture_digest": "861103a3816113e651b6a7fcf7261eedce97f64f6eb66024f87483328c821798",
      "language_standard": "c11",
      "input_mode": "shared-bitcode",
      "source_profile": "x86_64-linux-gnu-clang21@1.0",
      "target_profile": "riscv64-linux-gnu-lp64d-clang21@1.0",
      "rule_code": "long-double-abi",
      "scope": "fixtures/long-double-abi/negative-4",
      "expected_status": "not_matched",
      "finding_keys": [],
      "diagnostic_codes": [],
      "suppression_ids": [],
      "unsupported": false,
      "lifecycle": false,
      "review_basis": "reviewed negative boundary for long-double-abi"
    },
    {
      "case_id": "long-double-abi-negative-05",
      "fixture_digest": "861103a3816113e651b6a7fcf7261eedce97f64f6eb66024f87483328c821798",
      "language_standard": "c17",
      "input_mode": "ast-ir-evidence",
      "source_profile": "x86_64-linux-gnu-clang21@1.0",
      "target_profile": "riscv64-linux-gnu-lp64d-clang21@1.0",
      "rule_code": "long-double-abi",
      "scope": "fixtures/long-double-abi/negative-5",
      "expected_status": "not_matched",
      "finding_keys": [],
      "diagnostic_codes": [],
      "suppression_ids": [],
      "unsupported": false,
      "lifecycle": false,
      "review_basis": "reviewed negative boundary for long-double-abi"
    },
    {
      "case_id": "long-double-abi-negative-06",
      "fixture_digest": "861103a3816113e651b6a7fcf7261eedce97f64f6eb66024f87483328c821798",
      "language_standard": "c++17",
      "input_mode": "ast-only",
      "source_profile": "x86_64-linux-gnu-clang21@1.0",
      "target_profile": "riscv64-linux-gnu-lp64d-clang21@1.0",
      "rule_code": "long-double-abi",
      "scope": "fixtures/long-double-abi/negative-6",
      "expected_status": "not_matched",
      "finding_keys": [],
      "diagnostic_codes": [],
      "suppression_ids": [],
      "unsupported": false,
      "lifecycle": false,
      "review_basis": "reviewed negative boundary for long-double-abi"
    },
    {
      "case_id": "long-double-abi-unknown-01",
      "fixture_digest": "861103a3816113e651b6a7fcf7261eedce97f64f6eb66024f87483328c821798",
      "language_standard": "c17",
      "input_mode": "shared-bitcode",
      "source_profile": "x86_64-linux-gnu-clang21@1.0",
      "target_profile": "riscv64-linux-gnu-lp64d-clang21@1.0",
      "rule_code": "long-double-abi",
      "scope": "fixtures/long-double-abi/unknown-1",
      "expected_status": "unknown",
      "finding_keys": [],
      "diagnostic_codes": [
        "required_evidence_unknown"
      ],
      "suppression_ids": [],
      "unsupported": true,
      "lifecycle": false,
      "review_basis": "reviewed unknown boundary for long-double-abi"
    },
    {
      "case_id": "long-double-abi-unknown-02",
      "fixture_digest": "861103a3816113e651b6a7fcf7261eedce97f64f6eb66024f87483328c821798",
      "language_standard": "c++17",
      "input_mode": "ast-ir-evidence",
      "source_profile": "x86_64-linux-gnu-clang21@1.0",
      "target_profile": "riscv64-linux-gnu-lp64d-clang21@1.0",
      "rule_code": "long-double-abi",
      "scope": "fixtures/long-double-abi/unknown-2",
      "expected_status": "unknown",
      "finding_keys": [],
      "diagnostic_codes": [
        "required_evidence_unknown"
      ],
      "suppression_ids": [],
      "unsupported": true,